{
  "$schema": "https://json-schema.org/draft/2020-12/schema",
  "$id": "https://crypto-research-signal-system.local/strategy_discovery_v1/engine_fidelity_measurement_freeze_package_v2.schema.json",
  "title": "Engine Fidelity Measurement Freeze Package v2",
  "type": "object",
  "additionalProperties": false,
  "required": ["package_id","version","status","measurement_authorized","new_trial_ids_authorized","ledger","engine","technical_dependency","strategy_source","runtime","execution_manifest","data","pairlist_venue","harness","integrity_references","execution_policy","candidate_eligibility","freeze_rules","authorization"],
  "properties": {
    "package_id": {"const":"freqtrade_batch_001_engine_fidelity_measurement_freeze_v2"},
    "version": {"const":"2.0.0"},
    "status": {"const":"pre_measurement_freeze_prepared"},
    "measurement_authorized": {"const":false},
    "new_trial_ids_authorized": {"const":false},
    "ledger": {"type":"object","additionalProperties":false,"required":["n_trials","last_sequence","global_ledger_hash"],"properties":{"n_trials":{"const":898},"last_sequence":{"const":898},"global_ledger_hash":{"const":"2cd58e1a9716d30a1abd0f4722aaaba0cb892d49654704b1cd06f2f7d9b96d8e"}}},
    "engine": {"$ref":"#/$defs/pin"},
    "technical_dependency": {"$ref":"#/$defs/pin"},
    "strategy_source": {"type":"object","additionalProperties":false,"required":["repository","commit","license"],"properties":{"repository":{"const":"https://github.com/freqtrade/freqtrade-strategies"},"commit":{"const":"eff78d3ce3456b52c68a4e9a33cc055a56b801ff"},"license":{"const":"GPL-3.0"}}},
    "runtime": {"type":"object","additionalProperties":false,"required":["python","lock_path","lock_sha256","direct_lock_path","direct_lock_sha256"],"properties":{"python":{"const":"3.12.3"},"lock_path":{"type":"string"},"lock_sha256":{"type":"string","pattern":"^[0-9a-f]{64}$"},"direct_lock_path":{"type":"string"},"direct_lock_sha256":{"type":"string","pattern":"^[0-9a-f]{64}$"}}},
    "execution_manifest": {"type":"object","additionalProperties":false,"required":["path","canonical_sha256","file_sha256","status"],"properties":{"path":{"type":"string"},"canonical_sha256":{"type":"string","pattern":"^[0-9a-f]{64}$"},"file_sha256":{"type":"string","pattern":"^[0-9a-f]{64}$"},"status":{"const":"frozen_pre_backtest"}}},
    "data": {"type":"object","additionalProperties":false,"required":["main_manifest_path","main_manifest_sha256","main_scope","detail_manifest_path","detail_manifest_sha256","detail_scope","exact_csv_files"],"properties":{"main_manifest_path":{"type":"string"},"main_manifest_sha256":{"type":"string","pattern":"^[0-9a-f]{64}$"},"main_scope":{"$ref":"#/$defs/scope"},"detail_manifest_path":{"type":"string"},"detail_manifest_sha256":{"type":"string","pattern":"^[0-9a-f]{64}$"},"detail_scope":{"type":"object","additionalProperties":false,"required":["timeframe","exact_files_required","source_main_timeframes","no_resampling"],"properties":{"timeframe":{"const":"15m"},"exact_files_required":{"const":true},"source_main_timeframes":{"type":"array","const":["1h","4h","1d"]},"no_resampling":{"const":true}}},"exact_csv_files":{"type":"array","const":[{"file_name":"BTCUSDT_15m_2025-08-22_2026-08-21.csv","local_path":"strategy_discovery_v1/data/bybit_ohlcv_2025-08-22_2026-08-21/BTCUSDT_15m_2025-08-22_2026-08-21.csv","sha256":"b8bf0de78368bc56f4d57061d23722e461a7d2657515f2111bcd09f4c18fbab9","byte_size":2361431},{"file_name":"BTCUSDT_1d_2025-08-22_2026-08-21.csv","local_path":"strategy_discovery_v1/data/bybit_ohlcv_2025-08-22_2026-08-21/BTCUSDT_1d_2025-08-22_2026-08-21.csv","sha256":"bf3c05fea4ca2e89c89ce1d3c97767b559ac4906860b241257cbf6c13cd6f0f1","byte_size":26040},{"file_name":"BTCUSDT_1h_2025-08-22_2026-08-21.csv","local_path":"strategy_discovery_v1/data/bybit_ohlcv_2025-08-22_2026-08-21/BTCUSDT_1h_2025-08-22_2026-08-21.csv","sha256":"759c11ecdd7d4bb14437f03d9bb633fd48cab3931c277cc10cbee6a55c1b6960","byte_size":601662},{"file_name":"BTCUSDT_30m_2025-08-22_2026-08-21.csv","local_path":"strategy_discovery_v1/data/bybit_ohlcv_2025-08-22_2026-08-21/BTCUSDT_30m_2025-08-22_2026-08-21.csv","sha256":"f4a1a0898de4ee839204106afd0925c600ad50d8f5af71166d4a095b3ad1b574","byte_size":1190895},{"file_name":"BTCUSDT_4h_2025-08-22_2026-08-21.csv","local_path":"strategy_discovery_v1/data/bybit_ohlcv_2025-08-22_2026-08-21/BTCUSDT_4h_2025-08-22_2026-08-21.csv","sha256":"59a4cec4e6d876e940b834b692df8ba5c019939f8db12ebf1f487c1ed22621d9","byte_size":152770},{"file_name":"ETHUSDT_15m_2025-08-22_2026-08-21.csv","local_path":"strategy_discovery_v1/data/bybit_ohlcv_2025-08-22_2026-08-21/ETHUSDT_15m_2025-08-22_2026-08-21.csv","sha256":"9d63c1110ed543d9b74431cf42e1590e17989c6bddcd76105df645635019e051","byte_size":2348015},{"file_name":"ETHUSDT_1d_2025-08-22_2026-08-21.csv","local_path":"strategy_discovery_v1/data/bybit_ohlcv_2025-08-22_2026-08-21/ETHUSDT_1d_2025-08-22_2026-08-21.csv","sha256":"29e2f69e258b48a1280301cfa0cdf8d7bee9f33ca3e6dc93142e41e6c02dcd43","byte_size":25977},{"file_name":"ETHUSDT_1h_2025-08-22_2026-08-21.csv","local_path":"strategy_discovery_v1/data/bybit_ohlcv_2025-08-22_2026-08-21/ETHUSDT_1h_2025-08-22_2026-08-21.csv","sha256":"b9da720c84ad4ce444c7046833a618fc81f0b4ccce9fddd21a883fffc5052b78","byte_size":597907},{"file_name":"ETHUSDT_30m_2025-08-22_2026-08-21.csv","local_path":"strategy_discovery_v1/data/bybit_ohlcv_2025-08-22_2026-08-21/ETHUSDT_30m_2025-08-22_2026-08-21.csv","sha256":"1bad26f1f70bf3754bd2fa6d6f79bb33dfdda52899283440cc2116181eb49702","byte_size":1185372},{"file_name":"ETHUSDT_4h_2025-08-22_2026-08-21.csv","local_path":"strategy_discovery_v1/data/bybit_ohlcv_2025-08-22_2026-08-21/ETHUSDT_4h_2025-08-22_2026-08-21.csv","sha256":"88a9f58a82327d44749ecd0bb0f1a63400b6b78d54d5999b5f475018745e90d4","byte_size":152227}]}}},
    "pairlist_venue": {"type":"object","additionalProperties":false,"required":["mode","venue","market_type","quote_currency","pairs","dynamic_pairlist_allowed"],"properties":{"mode":{"const":"static_uniform"},"venue":{"const":"bybit"},"market_type":{"const":"linear_perpetual"},"quote_currency":{"const":"USDT"},"pairs":{"type":"array","const":["BTC/USDT:USDT","ETH/USDT:USDT"]},"dynamic_pairlist_allowed":{"const":false}}},
    "harness": {"type":"object","additionalProperties":false,"required":["contract_path","contract_sha256","parity_runner_path","parity_runner_sha256","parity_cases_expected","parity_cases_passed"],"properties":{"contract_path":{"type":"string"},"contract_sha256":{"type":"string","pattern":"^[0-9a-f]{64}$"},"parity_runner_path":{"type":"string"},"parity_runner_sha256":{"type":"string","pattern":"^[0-9a-f]{64}$"},"parity_cases_expected":{"const":13},"parity_cases_passed":{"const":13}}},
    "integrity_references": {"type":"object","additionalProperties":false,"required":["protocol_path","protocol_sha256","dependency_pin_manifest_path","dependency_pin_manifest_sha256","source_evidence_path","source_evidence_sha256","reassessment_path","reassessment_sha256","exclusion_resolution_path","exclusion_resolution_sha256"],"properties":{"protocol_path":{"type":"string"},"protocol_sha256":{"type":"string","pattern":"^[0-9a-f]{64}$"},"dependency_pin_manifest_path":{"type":"string"},"dependency_pin_manifest_sha256":{"type":"string","pattern":"^[0-9a-f]{64}$"},"source_evidence_path":{"type":"string"},"source_evidence_sha256":{"type":"string","pattern":"^[0-9a-f]{64}$"},"reassessment_path":{"type":"string"},"reassessment_sha256":{"type":"string","pattern":"^[0-9a-f]{64}$"},"exclusion_resolution_path":{"type":"string"},"exclusion_resolution_sha256":{"type":"string","pattern":"^[0-9a-f]{64}$"}}},
    "execution_policy": {"type":"object","additionalProperties":false,"required":["startup_candle_policy","missing_data_behavior","invalid_bar_behavior","unsupported_strategy_feature_behavior","configuration_override_behavior","precision_limits_policy","funding_policy"],"properties":{"startup_candle_policy":{"type":"string"},"missing_data_behavior":{"const":"fail_closed_skip_signal_and_do_not_carry_forward_missing_bars"},"invalid_bar_behavior":{"const":"fail_closed_exclude_invalid_bar_and_abort_candidate_if_required_series_is_invalid"},"unsupported_strategy_feature_behavior":{"type":"string"},"configuration_override_behavior":{"type":"string"},"precision_limits_policy":{"type":"object","additionalProperties":false,"required":["status","quantity_rounding","price_tick_size","minimum_order_qty","minimum_notional","required_before_measurement","missing_metadata_action"],"properties":{"status":{"const":"unresolved_external_exchange_metadata"},"quantity_rounding":{"type":"object","additionalProperties":false,"required":["base_asset_decimal_places","mode","zero_quantity_action"],"properties":{"base_asset_decimal_places":{"const":6},"mode":{"const":"floor"},"zero_quantity_action":{"const":"skip_order"}}},"price_tick_size":{"type":"null"},"minimum_order_qty":{"type":"null"},"minimum_notional":{"type":"null"},"required_before_measurement":{"const":true},"missing_metadata_action":{"const":"fail_closed"}}},"funding_policy":{"type":"string"}}},
    "candidate_eligibility": {"type":"object","additionalProperties":false,"required":["final_status","measurement_eligible_count","conditional_count","conditional","remain_excluded","blocking_conditions"],"properties":{"final_status":{"const":"conditional_not_measurement_ready"},"measurement_eligible_count":{"const":0},"conditional_count":{"const":6},"conditional":{"type":"array","minItems":6,"maxItems":6,"uniqueItems":true,"items":{"type":"object","additionalProperties":false,"required":["document_id","source_path","timeframe","main_data_timeframes","detail_timeframe","status"],"properties":{"document_id":{"type":"string"},"source_path":{"type":"string"},"timeframe":{"enum":["1h","4h","1d"]},"main_data_timeframes":{"type":"array","minItems":1,"items":{"enum":["1h","4h","1d"]}},"detail_timeframe":{"const":"15m"},"status":{"const":"conditional_pending_engine_native_validation"}}}},"remain_excluded":{"type":"array","minItems":5,"items":{"type":"object"}},"blocking_conditions":{"type":"array","minItems":3,"items":{"type":"string"}}}},
    "freeze_rules":{"type":"array","minItems":3,"items":{"type":"string"}},
    "authorization":{"type":"object","additionalProperties":false,"required":["backtest_authorized","market_data_acquisition_authorized","trial_creation_authorized","ledger_update_authorized","dsr_pbo_cpcv_authorized","promotion_allowed","paper_or_live_allowed"],"properties":{"backtest_authorized":{"const":false},"market_data_acquisition_authorized":{"const":false},"trial_creation_authorized":{"const":false},"ledger_update_authorized":{"const":false},"dsr_pbo_cpcv_authorized":{"const":false},"promotion_allowed":{"const":false},"paper_or_live_allowed":{"const":false}}}
  },
  "$defs": {
    "pin": {"type":"object","additionalProperties":false,"required":["repository","commit","file_hashes"],"properties":{"repository":{"type":"string"},"commit":{"type":"string","pattern":"^[0-9a-f]{40}$"},"file_hashes":{"type":"object","minProperties":1,"additionalProperties":{"type":"string","pattern":"^[0-9a-f]{64}$"}}}},
    "scope": {"type":"object","additionalProperties":false,"required":["venue","market_type","symbols","timeframes","date_window_utc"],"properties":{"venue":{"const":"bybit"},"market_type":{"const":"linear_perpetual"},"symbols":{"type":"array","const":["BTCUSDT","ETHUSDT"]},"timeframes":{"type":"array","const":["1h","4h","1d"]},"date_window_utc":{"type":"array","const":["2025-08-22","2026-08-21"]}}}
  }
}
