{
  "authorization": {
    "backtest_authorized": false,
    "dsr_pbo_cpcv_authorized": false,
    "ledger_update_authorized": false,
    "market_data_acquisition_authorized": false,
    "paper_or_live_allowed": false,
    "promotion_allowed": false,
    "trial_creation_authorized": false
  },
  "candidate_eligibility": {
    "blocking_conditions": [
      "full pinned Freqtrade engine must be installed and executable in the locked runtime",
      "exact exchange precision and minimum limits metadata must be supplied or explicitly frozen",
      "Supertrend requires engine-native validation in the locked package"
    ],
    "conditional": [
      {
        "detail_timeframe": "15m",
        "document_id": "eff78d3ce3456b52c68a4e9a33cc055a56b801ff:user_data/strategies/CustomStoplossWithPSAR.py",
        "main_data_timeframes": [
          "1h"
        ],
        "source_path": "user_data/strategies/CustomStoplossWithPSAR.py",
        "status": "conditional_pending_engine_native_validation",
        "timeframe": "1h"
      },
      {
        "detail_timeframe": "15m",
        "document_id": "eff78d3ce3456b52c68a4e9a33cc055a56b801ff:user_data/strategies/Heracles.py",
        "main_data_timeframes": [
          "4h"
        ],
        "source_path": "user_data/strategies/Heracles.py",
        "status": "conditional_pending_engine_native_validation",
        "timeframe": "4h"
      },
      {
        "detail_timeframe": "15m",
        "document_id": "eff78d3ce3456b52c68a4e9a33cc055a56b801ff:user_data/strategies/HourBasedStrategy.py",
        "main_data_timeframes": [
          "1h"
        ],
        "source_path": "user_data/strategies/HourBasedStrategy.py",
        "status": "conditional_pending_engine_native_validation",
        "timeframe": "1h"
      },
      {
        "detail_timeframe": "15m",
        "document_id": "eff78d3ce3456b52c68a4e9a33cc055a56b801ff:user_data/strategies/MultiMa.py",
        "main_data_timeframes": [
          "4h"
        ],
        "source_path": "user_data/strategies/MultiMa.py",
        "status": "conditional_pending_engine_native_validation",
        "timeframe": "4h"
      },
      {
        "detail_timeframe": "15m",
        "document_id": "eff78d3ce3456b52c68a4e9a33cc055a56b801ff:user_data/strategies/PatternRecognition.py",
        "main_data_timeframes": [
          "1d"
        ],
        "source_path": "user_data/strategies/PatternRecognition.py",
        "status": "conditional_pending_engine_native_validation",
        "timeframe": "1d"
      },
      {
        "detail_timeframe": "15m",
        "document_id": "eff78d3ce3456b52c68a4e9a33cc055a56b801ff:user_data/strategies/Supertrend.py",
        "main_data_timeframes": [
          "1h"
        ],
        "source_path": "user_data/strategies/Supertrend.py",
        "status": "conditional_pending_engine_native_validation",
        "timeframe": "1h"
      }
    ],
    "conditional_count": 6,
    "final_status": "conditional_not_measurement_ready",
    "measurement_eligible_count": 0,
    "remain_excluded": [
      {
        "reason": "No exact 5m OHLCV in frozen data manifest; no new data authorized; no resampling.",
        "source_path": "user_data/strategies/BreakEven.py",
        "status": "remain_excluded",
        "timeframe": "5m",
        "trial_created": false
      },
      {
        "reason": "No exact 5m OHLCV in frozen data manifest; no new data authorized; no resampling.",
        "source_path": "user_data/strategies/Diamond.py",
        "status": "remain_excluded",
        "timeframe": "5m",
        "trial_created": false
      },
      {
        "reason": "No exact 12h OHLCV in frozen data manifest; no new data authorized; no resampling.",
        "source_path": "user_data/strategies/GodStra.py",
        "status": "remain_excluded",
        "timeframe": "12h",
        "trial_created": false
      },
      {
        "reason": "No exact 5m OHLCV in frozen data manifest; no new data authorized; no resampling.",
        "source_path": "user_data/strategies/PowerTower.py",
        "status": "remain_excluded",
        "timeframe": "5m",
        "trial_created": false
      },
      {
        "reason": "No exact 5m OHLCV in frozen data manifest; no new data authorized; no resampling.",
        "source_path": "user_data/strategies/Strategy004.py",
        "status": "remain_excluded",
        "timeframe": "5m",
        "trial_created": false
      },
      {
        "reason": "Exact Supertrend implementation pinned for future v2 validation; historical v1 harness is not rerun.",
        "source_path": "user_data/strategies/Supertrend.py",
        "status": "dependency_resolved_pending_new_measurement",
        "timeframe": "1h",
        "trial_created": false
      }
    ]
  },
  "data": {
    "detail_manifest_path": "strategy_discovery_v1/data/bybit_ohlcv_drive_roundtrip_manifest.json",
    "detail_manifest_sha256": "d4ec91de7ec0193e8459b4dea6db5f44a6f3aac471ec62ae465c9ff59fbd7c9f",
    "detail_scope": {
      "exact_files_required": true,
      "no_resampling": true,
      "source_main_timeframes": [
        "1h",
        "4h",
        "1d"
      ],
      "timeframe": "15m"
    },
    "exact_csv_files": [
      {
        "byte_size": 2361431,
        "file_name": "BTCUSDT_15m_2025-08-22_2026-08-21.csv",
        "local_path": "strategy_discovery_v1/data/bybit_ohlcv_2025-08-22_2026-08-21/BTCUSDT_15m_2025-08-22_2026-08-21.csv",
        "sha256": "b8bf0de78368bc56f4d57061d23722e461a7d2657515f2111bcd09f4c18fbab9"
      },
      {
        "byte_size": 26040,
        "file_name": "BTCUSDT_1d_2025-08-22_2026-08-21.csv",
        "local_path": "strategy_discovery_v1/data/bybit_ohlcv_2025-08-22_2026-08-21/BTCUSDT_1d_2025-08-22_2026-08-21.csv",
        "sha256": "bf3c05fea4ca2e89c89ce1d3c97767b559ac4906860b241257cbf6c13cd6f0f1"
      },
      {
        "byte_size": 601662,
        "file_name": "BTCUSDT_1h_2025-08-22_2026-08-21.csv",
        "local_path": "strategy_discovery_v1/data/bybit_ohlcv_2025-08-22_2026-08-21/BTCUSDT_1h_2025-08-22_2026-08-21.csv",
        "sha256": "759c11ecdd7d4bb14437f03d9bb633fd48cab3931c277cc10cbee6a55c1b6960"
      },
      {
        "byte_size": 1190895,
        "file_name": "BTCUSDT_30m_2025-08-22_2026-08-21.csv",
        "local_path": "strategy_discovery_v1/data/bybit_ohlcv_2025-08-22_2026-08-21/BTCUSDT_30m_2025-08-22_2026-08-21.csv",
        "sha256": "f4a1a0898de4ee839204106afd0925c600ad50d8f5af71166d4a095b3ad1b574"
      },
      {
        "byte_size": 152770,
        "file_name": "BTCUSDT_4h_2025-08-22_2026-08-21.csv",
        "local_path": "strategy_discovery_v1/data/bybit_ohlcv_2025-08-22_2026-08-21/BTCUSDT_4h_2025-08-22_2026-08-21.csv",
        "sha256": "59a4cec4e6d876e940b834b692df8ba5c019939f8db12ebf1f487c1ed22621d9"
      },
      {
        "byte_size": 2348015,
        "file_name": "ETHUSDT_15m_2025-08-22_2026-08-21.csv",
        "local_path": "strategy_discovery_v1/data/bybit_ohlcv_2025-08-22_2026-08-21/ETHUSDT_15m_2025-08-22_2026-08-21.csv",
        "sha256": "9d63c1110ed543d9b74431cf42e1590e17989c6bddcd76105df645635019e051"
      },
      {
        "byte_size": 25977,
        "file_name": "ETHUSDT_1d_2025-08-22_2026-08-21.csv",
        "local_path": "strategy_discovery_v1/data/bybit_ohlcv_2025-08-22_2026-08-21/ETHUSDT_1d_2025-08-22_2026-08-21.csv",
        "sha256": "29e2f69e258b48a1280301cfa0cdf8d7bee9f33ca3e6dc93142e41e6c02dcd43"
      },
      {
        "byte_size": 597907,
        "file_name": "ETHUSDT_1h_2025-08-22_2026-08-21.csv",
        "local_path": "strategy_discovery_v1/data/bybit_ohlcv_2025-08-22_2026-08-21/ETHUSDT_1h_2025-08-22_2026-08-21.csv",
        "sha256": "b9da720c84ad4ce444c7046833a618fc81f0b4ccce9fddd21a883fffc5052b78"
      },
      {
        "byte_size": 1185372,
        "file_name": "ETHUSDT_30m_2025-08-22_2026-08-21.csv",
        "local_path": "strategy_discovery_v1/data/bybit_ohlcv_2025-08-22_2026-08-21/ETHUSDT_30m_2025-08-22_2026-08-21.csv",
        "sha256": "1bad26f1f70bf3754bd2fa6d6f79bb33dfdda52899283440cc2116181eb49702"
      },
      {
        "byte_size": 152227,
        "file_name": "ETHUSDT_4h_2025-08-22_2026-08-21.csv",
        "local_path": "strategy_discovery_v1/data/bybit_ohlcv_2025-08-22_2026-08-21/ETHUSDT_4h_2025-08-22_2026-08-21.csv",
        "sha256": "88a9f58a82327d44749ecd0bb0f1a63400b6b78d54d5999b5f475018745e90d4"
      }
    ],
    "main_manifest_path": "strategy_discovery_v1/data/bybit_ohlcv_drive_roundtrip_manifest.json",
    "main_manifest_sha256": "d4ec91de7ec0193e8459b4dea6db5f44a6f3aac471ec62ae465c9ff59fbd7c9f",
    "main_scope": {
      "date_window_utc": [
        "2025-08-22",
        "2026-08-21"
      ],
      "market_type": "linear_perpetual",
      "symbols": [
        "BTCUSDT",
        "ETHUSDT"
      ],
      "timeframes": [
        "1h",
        "4h",
        "1d"
      ],
      "venue": "bybit"
    }
  },
  "engine": {
    "commit": "eb1a668ceb0f29b7d578156bfc24c45278c0c0f8",
    "file_hashes": {
      "freqtrade/optimize/backtesting.py": "2420410f96451cb993a7b475e9f7a4232d89480185cc25c59da8883551be6384",
      "freqtrade/strategy/interface.py": "e372b562aabf5e39e444a222f36c7c14801b254fa42141f1431a4ba95d313bb0"
    },
    "repository": "https://github.com/freqtrade/freqtrade"
  },
  "execution_manifest": {
    "canonical_sha256": "041cb089d7655adabf6b67d6e62b2c0cf9e9281690719e5b5f943eb5607c2b97",
    "file_sha256": "7820c7c832c1a0a4eabf0fc02a4d38b48699f851feadfbfd57a477ac7691f51e",
    "path": "strategy_discovery_v1/second_collection_v1/data/execution_assumption_manifest_v1_2_frozen.json",
    "status": "frozen_pre_backtest"
  },
  "execution_policy": {
    "configuration_override_behavior": "fail_closed_reject_any_candidate_specific_or_runtime_override",
    "funding_policy": "zero_funding_proxy_is a material limitation and must remain unchanged unless a new versioned manifest is authorized",
    "invalid_bar_behavior": "fail_closed_exclude_invalid_bar_and_abort_candidate_if_required_series_is_invalid",